,title,methods,discussion
4,Reprioritizing life  A conceptual model of how women with type 1 diabetes deal with main concerns in early motherhood.,"Grounded theory methodology aims to explain a general pattern of behaviour (Glaser & Strauss, 1967). In the present study a constructivist, grounded theory was chosen according to Charmaz (2014), who stresses that the “researcher is a part of what they study, not separate from it” (Charmaz, 2014, p. 320).
The women were recruited retrospectively from participants in a randomized controlled trial (RCT) evaluating web-based support carried out in Sweden for women with T1DM during pregnancy and up to 6 months after childbirth (MODIAB-Web). Women from both the intervention and control groups at three of the six included hospitals were asked to participate. The health care in the respective hospitals differed somewhat. In pregnancy all women with T1DM had frequent follow-ups at a hospital-based special antenatal care unit, which ended with a final followup around 6 weeks after birth. Parental leave in Sweden is financed by the Swedish Social Insurance Agency and the employer, and parents can use 480 days of paid parental leave for each child. Most of these days can be divided between the parents. The majority of mothers take full-time leave during the first months after birth (the Swedish Social Insurance Agency, 2010).
Based on a purposeful sampling procedure, eligible women were contacted by phone after data collection for the MODIAB-Web study was completed, that is, at least 6 months after childbirth, and asked about their willingness to participate in the present study. Of 18 women contacted, 4 declined and 14 agreed to participate. Interviews were conducted between 2014 and 2016. The participants had a median diabetes duration of 24 years (range 5–30). Their median age was 33 years (range 25–40); eight of them were primiparous and six were multiparous. One woman was single, and the others were living with the father of the child. Most women had a university degree (n = 8), five had completed secondary school, and one primary school.
The interviews were conducted 7–17 months after childbirth by three different researchers at a place chosen by the women. Five interviews were conducted by telephone due to distance. Each interview started with open-ended questions such as “Could you please tell me how you would describe your situation as a new mother with type 1 diabetes and how you handle your situation as a new mother with type 1 diabetes?” In accordance with the methodology, follow-up questions were posed, based on emergent data from previously analysed interviews (Corbin & Strauss, 2008). The interviews lasted 25–60 min and were audiotaped and transcribed verbatim.","In line with what was described in our study regarding the benefits of having technical tools that support daily life, it seems relevant to advocate for the availability of getting CGM advice in the early postpartum period. This would be to assist the mother’s adjustment to rapid changes in blood glucose levels, and especially to avoid hypoglycaemic episodes, as they interfere with taking care of the baby, including the child’s security. The women’s heightened awareness of the need for control, together with a reassuring effect of early alarms in case of a trend towards hypoglycaemia, might support these women in taking command of their diabetes. Fallon and Dunne (2015) claim that fundamental needs for women with type 1 diabetes are those related to safety and security. Since professional support is not available 24 h a day, particularly during early motherhood, technical devices can assist in continuously monitoring the unfamiliar and unpredictable blood glucose levels. This could be time and energy saving and might decrease the burden of daily self-management, potentially leading to better wellbeing and less exhaustion for these women. This is in line with what was found in a previous study by our research group (Berg & Sparud-Lundin, 2012; Berg et al., 2012).
Beyond technical devices for diabetes management, healthcare providers and peers could play a crucial role in supporting these women during early motherhood. The form of antenatal care provider has been found to influence the intention to breastfeed in women with diabetes (Finkelstein et al., 2013). For women in our study the frequent contacts with the antenatal care providers during pregnancy were abruptly interrupted when the child was born. Other healthcare professionals, either during the early postpartum care or after discharge, did not replace their supportive role. During a period of experiencing a more unfamiliar diabetes than ever before, and with reformulated incentives for taking care of themselves simultaneously with caring for the baby, most of the women in our study felt left with the responsibility. As the healthcare system did not support them sufficiently during early motherhood, they searched for support from other women in similar conditions. This is in line with the findings of Edwards et al. (2016), who made an extensive qualitative exploration of 200 electronic interactions between women with type 1 diabetes, from planning pregnancy, throughout pregnancy, and into early motherhood. The communication was retrieved from a free Internet-based counselling service and psychosocial support provided by a non-profit organization mainly for people with diabetes. Diabetes-specific distress was most frequent during “contemplation”, for example, when considering pregnancy, followed closely by the phase of motherhood. Depressed mood peaked during motherhood, and partners were not always able to understand their experiences. The authors conclude that contacts with other women who have experiences of pregnancy and motherhood seem to offer assurance not provided by their healthcare providers (Edwards et al., 2016). Although healthcare providers can assist in advising on how to make adjustments in insulin doses and so forth in order to balance the juggling of blood glucose, peers with diabetes are more likely to help prioritize the dual role in early motherhood.
Although the findings in this study resonate with other research, and by that demonstrate transferability, some limitations need to be acknowledged. First, the question of selection bias is always present in research studies. However, the effort to achieve a INTERNATIONAL JOURNAL OF QUALITATIVE STUDIES ON HEALTH AND WELL-BEING 7 varied sample of women with type 1 diabetes with respect to experiences both of being a first-time mother and of having given birth earlier increases external validity. Second, socioeconomic differences regarding educational levels, social welfare systems (for paid parental leave) and healthcare systems, as well as varying sociocultural attitudes towards breastfeeding, can have an impact on the transferability of the findings to other societies.
Having diabetes and being in the early period after giving birth to a child is demanding and challenging. The healthcare system needs to support these women, especially first-time mothers. After the extraordinary health care provided during pregnancy, it would be highly relevant and important to at least phase out the frequent support more gradually after the childbirth, not least because of the new challenges faced in relation to diabetes management in early motherhood. Therefore, we propose that a woman with type 1 diabetes should have planned and frequent contacts with her diabetes nurse directly after childbirth, preferably arranged beforehand. To secure the diabetes management support, telephone follow-up once or twice a week could be relevant during this extra-demanding period, as well as accessibility to technical support for facilitating daily self-management, if wanted. Moreover, providing these women with alternative sources for health information and peer support beyond the antenatal and diabetes care has the potential to improve their life situation during motherhood. This needs to be further investigated in upcoming studies."
5,Classroom interaction in effective and ineffective schools  Preliminary results from phase III of the Louisiana school effectiveness study,"Twelve school systems had comprised the LSES-II population. One additional large system was added to the sampling pool for LSES-III. Nine pairs of schools were chosen using the following procedure:
Within individual school systems, third grade school means on the Total Reading section of the state Basic Skills Test (BST)1 were computed. The BST is administered in late March of each year. Mean scores were developed for both the '82-'83 and '83- '84 school years.
Within each large school system, and among contiguous rural systems, regression models were developed in which mother's education, father's profession, and student body racial composition were independent variables predicting mean BST reading scores. A total of seven separate models were used.
A school was considered for inclusion in LSES-II if a) the school scored above (or below) achievement prediction both years, b) the school scored substantially above (below) prediction at least one year, and c) a matching opposite directional outlier of similar racial composition was identified within that system (or in a contiguous system in the rural models).","Third, at Adams, and at almost all positive outlier schools in LSES-III, there was a prominent display of the names of academic honor roll students in a heavily traveled hall near the principal's office. Academic excellence was the single most important goal of the school. Of central interest in LSES-III, the school's commitment to academics had been translated into in-class action. The rate of interactive instructing at Adams nearly doubled that at Fillmore. Similarly, time spent in organizing and off-task activities was a third lower at Adams.
If a rational, data based school improvement literature is to develop, it will require information from both the school-effectiveness and teacher-effectiveness literatures. Good and Brophy (1986) have argued for research which nests classroom interaction studies within larger school effectiveness studies. Such research can provide a bridge between the school effectiveness and more devel­ oped teacher effectiveness literatures. LSES-III is one such study. We are just beginning the analysis of data from this phase, yet the first preliminary analyses presented here indicate that the method offers promise. If further analyses confirm our findings in the 16 school database, and if other studies replicate.
LSES-III findings, then connections will have been built between the ""process"" of the two fields, and substantial progress will have been made toward the development of a more unified model of effective schooling.
Given that practice cannot wait on theory development, practical issues should be addressed. To date, the quasi-experimental teacher effectiveness literature is much more developed than similar efforts in the school effectiveness field. The preliminary findings of LSES-III suggest that school ""culture"" and other school level variables are translated in effective schools into specific, measurable teacher behaviors. In several studies (e.g., Anderson, Evertson, and Brophy, 1979; Good and Grouws, 1979; Stallings, 1980) these teacher behaviors have proven alterable through extensive, specific, behaviorally based workshops series. Future school improvement studies might find added strength in in-depth efforts to change patterns of classroom interaction."
6,Exploring the nature of counterfactual thinking and their perceived consequences in an elite sporting context  An interpretative phenomenological analysis,"Seven athletes (4 male, 3 female) were recruited to take part in the study. They represent a range of different sports (Rifle Shooting, 3; Athletics, 1; Football, 1; Fencing, 1; Swimming, 1) and have all competed at professional, national or international level (including Woman’s Premier South, World Championships, World Cups, European Championships, British Championships, Commonwealth games, and Paralympics games). In accordance with Swann and colleagues (2015), participants therefore represented competitive-elite and successfulelite athlete populations. Participants were aged 20–68 years (M = 33.29, SD= 16.40) and were selected from a range of sports to provide and explore different contexts of counterfactuals. To provide free recollections of counterfactuals, participants were also required to be involved in regular training and have recently competed.
A qualitative interview methodology was u to explore the nature of counterfactuals and their perceived consequences in elite athletes. Semistructured interviews were conducted to gather participant data underpinned by a phenomenological perspective, which aims to understand the athlete’s personal lived experience of a phenomenon (Smith & Osborn, 2003). In relation to the phenomenological approach, an Interpretative Phenomenological Analysis (IPA; Smith,1996) was used to analyze the data obtained as it ‘‘offers psychologists the opportunity to learn from the insights of the experts—research participants themselves’’ (Reid, Flowers, & Larkin, 2005, p. 20).
The semistructured interview schedule was constructed to suit the use of IPA and follow the guidelines set by Smith (1995) and Smith and Osborn (2003). The interviews were designed to allow the interviewer to frame questions in a broad and open manner and to prompt for more detail if needed. Using suggestions by Smith and Osborn (2003), the first section of the interview was designed to build rapport with participants, through the discussion of their history in their particular sport, their season so far and then a discussion of a recent competitive event to explore the use of counterfactuals and their perceived consequences.
Participants were asked to recall their personal experience of counterfactuals and their perceived consequences around a recent event. A general open question ‘Tell me about your personal experience of a recent positive/ negative event that you thought could have turned out differently. . . ’ was used to get a detailed outline of the event and the counterfactuals experienced. From this, the interviewer used probing questions to get more details on the counterfactual’s type (e.g., upward or downward), content, direction (e.g., self or others), structure (e.g., additive or subtractive), controllability and their perceived consequences (e.g., thoughts, behaviors and emotions). These probing questions were designed to be a ‘gentle nudge from the interviewer’ (Smith & Osborn, 2003) to reduce researcher bias and avoid leading the participant to a predetermined conclusion. As most of the initial counterfactuals were of an upward nature, the process was repeated to explore downward counterfactuals during the specified events. A draft of the interview schedule was piloted in an interview carried out with a novice squash player. This informed the final draft of the interview schedule.","It is acknowledged that the small sample size limits its generalizability. The study aimed to gather similar numbers of both male and female athletes to ensure both populations were represented. However, gaining an equal number of participants depending on type of sport (e.g., individual vs team, closed vs open skills) was not a priority. In this study, one athlete participated in a team sport and there was evidence that counterfactuals would be influenced by contextual factors such as being part of a group. For example, a team athlete might experience more counterfactuals directed at others’ behaviors that influence outcome. This might be seen as less controllable and might influence the consequences associated with the counterfactuals experienced. Future research might aim to explore these differences and the possible gender differences in the generation and experience of counterfactuals and their perceived consequences regarding elite athletes.
In using semistructured interviews to explore athletes’ counterfactuals, it is plausible that memory decay and poor reconstructive processes may have influenced participants’ responses (Brewer, Van Raalte, Linder, & Van Raalte 1991; Smith, Leffingwell, & Ptacek, 1999). Reporting on significant past events or capturing in the moment counterfactual thoughts, think out load protocols could be applied in future (Nicholls & Polman, 2008). However, both think out loud and semistructured interview protocols are researcher prompted. Alternative methods such as archival methods might be used to capture self-generated counterfactuals.
Despite the limitations, the use of currently competing elite athletes provided ecologically validity to the representation of counterfactuals experienced and their perceived consequences. Findings from this study could be of value for those in the applied settings working with both elite athletes and less experienced athletes. Upward counterfactuals present themselves when performance does not reach a certain level set by expectations or goals. It is therefore important to monitor each athlete’s expectations and ensure the athlete’s goals are flexible to alleviate negative emotional consequences that could be debilitative to performance or motivation. This may be shaped by the cultural environment and their goals. Goals around process and development may lead to an assimilation effect where motivation and performance can be enhanced. In relation to the REM (Markman & McMullen, 2003), upward counterfactual thoughts would be best used in a reflective process following an event to inform goals and intention for future practice and competitive behavior change. These could also be useful for significant others (e.g., coaches, physiotherapist, support staff) to inform how they might deal with issues brought up by the athlete that they might influence. For example, if there is conflict between two athletes then a coach might use each athlete’s counterfactuals using reflective practice to come up with a management strategy to overcome the issue. In addition, counterfactuals could be used to gain perspective on these goals and protect an athlete’s self-esteem following failure (McCrea, 2008). Beyond the scope of elite athletes, individuals who participate in performance related activities (e.g., business, sport & exercise practitioners, health services) would benefit from lessons learned from elite athletes to understand and suitably use counterfactuals to facilitate cognitive, emotional and behavioral change to enhance their practice.
This study taps into the experiences elite athletes have of counterfactuals. It also provides an insight into how elite athletes cope with the negatives effects of counterfactuals as well as use the positive effects of counterfactuals to improve and sustain high performance. Future research on elite athletes’ counterfactual thoughts using experimental and longitudinal studies would be beneficial to investigate the antecedents and consequences of counterfactual thinking on training and performance. The use of an elite population could be a useful source for understanding high performance athletes and how they experience thoughts, emotions and behaviors. By understanding how elite athletes generate, experience and reflect on counterfactuals, it is hoped other athletes can use counterfactuals to identify causal inferences and deploy accompanying changes to enhance both performance and motivation to succeed making sport more fulfilling and enjoyable."
