,title,methods,discussion
0,Common Modality Effects in Immediate Free Recall and Immediate Serial Recall,"Forty participants from the University of Essex took part in this experiment. There were five males and 35 females ranging from 18 to 39 years of age. The mean age was 20.8 years (standard deviation
4.2). All participants confirmed that they were fluent in English.
The materials consisted of a subset of 440 words that were randomly selected for each participant from the Toronto Noun Pool (Friendly, Franklin, Hoffman, & Rubin, 1982). Audio file versions of each word were obtained from Michael Kahana’s Computational Memory Laboratory web site (Kahana, 2010; http://memory.psych.upenn.edu/WordPools). The shortest sound file was 0.350 s; the longest sound file was 0.860 s. Audio files were presented via a Logitech USB Headset 4.330 at a volume comfortable to each participant. The words were presented in 60-point Times New Roman font. The materials were presented on an Apple eMac computer monitor using the Supercard application.
The experiment used a mixed design. The betweensubjects independent variable was the task with two levels (ISR or IFR). There were three within-subjects independent variables: modality with two levels (visual and auditory), list length with seven levels (two, four, five, six, seven, eight, and 12), and serial position with up to 12 levels (serial position 1–12). The main dependent variables were the proportion of words recalled in any order (FR scoring), the proportion of words recalled in the correct serial position (SR scoring), and the probability of initiating recall with the very first list item—that is, Probability of First Recall (PFR)
Serial Position 1.
Participants were tested individually and informed that they would be shown two practice lists, of seven words each, followed by 70 experimental lists of words. Participants were allocated to one of two groups: either the ISR group (where they should remember the words in the correct order), or the IFR group (where they can remember the words in any order). The two practice trials consisted of one visual trial and one auditory trial. The experimental trials were split into two equal blocks of 35 trials each. Each block consisted of only visual trials or auditory trials. The order of the blocks was counterbalanced across participants. In all conditions, the order of the list lengths was randomized, such that each block contained five repetitions of each list length. Participants were not aware of the length of the list in advance of its presentation.","A third feature of our data that may constrain unified accounts of modality effects is that the magnitude of modality differences is greatest when participants initiate their recall from the start of the list. This suggests that a major factor in determining the modality effect in both IFR and ISR is the greater resistance to output interference observed with auditory stimuli (including visual words that are read aloud) relative to words in the visual silent presentation condition (Cowan et al., 2002, 2004). One explanation for the resilience of auditory items within our data sets is that auditory words are stored with more enriched sets of features than visual items (e.g., Nairne, 1990; Neath, 2000), and that recalled list items interfere with the recall of as yet to-be-remembered items. If we further assume that the internalized voice that accompanies silent written recall at output is more similar to the internalized voice that accompanies covert phonological recoding in the visual silent presentation condition, then as recall progresses the differences in the effect of subsequent recalls (output interference) on visual relative to auditory yet-to-be-recalled items will increase.
A fourth and final feature of our data that may constrain unified accounts of IFR and ISR is the confirmation of inverse modality effects (Beaman, 2002; Macken et al., 2016): visual recall advantages that occur in early mid serial positions with medium to long list lengths. Consistent with Macken et al. (2016), we assume that the modality of presentation affects the way that all the list items are processed. We agree that presenting stimuli in the visual silent conditions may be more conducive to cumulative forward-ordered rehearsal than visual read aloud as the former but not the latter is unimpeded by the need to articulate or vocalize each currently presented item. We are also willing to accept that participants might either feel a greater necessity to rehearse the visual silent items relative to the words in the auditory condition in order to form groups or subsequences of lists and/or be less able to incorporate the current auditory presented word into a cumulatively expanding rehearsal set. The benefits of cumulative forwardordered rehearsal may be greatest not at the start of the list but at early mid list positions (see Grenfell-Essam et al., 2013), and the benefit may be greatest at longer list lengths, where there might be both greater rehearsal opportunities and where the difficulty in recalling unrehearsed early list items might be more difficult (see Ward, 2002). Currently, many contemporary accounts of IFR and ISR (e.g., the SIMPLE model, Brown et al., 2007; the feature model, e.g., Nairne, 1990; Neath, 2000; and the Farrell, 2012 model) do not incorporate an account of rehearsal. However, our data suggest that recall of read aloud stimuli is reasonably similar to the recall of auditory stimuli, and we do not find the lowered levels of overall performance observed in the read aloud conditions of Macken et al. (2016). Of course, there are many differences between the methodologies used in our study and that of Macken et al. (2016). Most notably, we used different tasks, an experiment-unique set of stimuli, words rather than consonants and a rate of presentation of one word per second that was slightly slower than that standardly used by Macken et al. (2016; 750 ms per word).
Our preferred explanation of our data is that the modality of presentation affects the processing of the entire list of items. We assume that longer lists are parsed into multiple groups (of varying sizes), and the presentation of each auditory (or read aloud) item leads to a set of more richly encoded features than those encoded following the presentation of each visual silent item. The modality of presentation does not affect the PFR, as each item within the same modality in the list is encoded with the same richness of features. However, the encoding of relatively impoverished written recalled items will create greater relative interference for the impoverished visual items than the richly encoded auditory items, leading to improved recall of auditory over visual items on later recalls. We finally assume that participants might rehearse in a cumulative forward-ordered manner with all lists, but they may be able to rehearse longer sequences of early lists items with visual silent lists than with either auditory or read aloud lists.
In summary, we have reported a systematic exploration of the modality effects across a wide range of list lengths in both IFR and ISR, contrasting visual silent presentation with both auditory (Experiment 1) and read aloud (Experiment 2) presentation. We have shown that the magnitude and extent of modality effects are similar across tasks when the list length is controlled, and we have also shown inverse modality effects in both tasks in early mid list positions for medium to long lists. We believe these findings encourage attempts to provide a unified account of both IFR and ISR. We believe that in both tasks, modality effects arise through the greater resilience of auditory items to output interference. Our data provide four findings that will constrain the development of such a theory, and additionally provide a rich data set that could be used to model the development of the serial position curve with each successively presented list item."
1,Retuning of Lexical-Semantic Representations  Repetition and Spacing Effects in Word-Meaning Priming,"Thirty-three native British English speakers participated in the current experiment. However, only the data from 30 participants (23 females; mean age 24.8, range 18 – 401 ) were analysed: one participant was excluded for exceeding age requirements and two participants were excluded because of a software error, which prevented task completion. All participants reported that they had no language, hearing or vision impairments (other than corrected-to-normal vision) and had lived in the U.K. for the majority of their lives, speaking English as their first language from birth. Participants were recruited via the University College London online recruitment system or advertisements on the university campus and paid the standard rate at the time of £6/hour2 .
Sixty ambiguous words (e.g., bark, cabinet) were selected from a pretested set that had assessed dominance using a standard word association test (Warren, Vitello, Devlin & Rodd, in preparation; see the Appendix for ambiguous word list). These words had a dominance rating of 12– 42% for the subordinate meaning (mean of 25%). In all cases the primed subordinate meaning had the same pronunciation and spelling as the dominant meaning, although in some cases there was an additional meaning with a different spelling (e.g., ‘break/brake’). Polysemous words were also included as long as the related meanings were judged by the author as sufficiently distinct that they could be distinguished on the basis of word association responses (e.g., typical associates related to the two related meanings of ‘wave,’ disturbance in water or hand gesture, were deemed sufficiently distinct, whereas those to the two meanings of ‘passage,’ corridor/tunnel or journey over time/distance, were not. Thirty-eight words were classed as polysemous; Parks, Ray, & Bland, 1998).
For the subordinate prime task, a total of 60 short paragraphs (mean length of 70 words) were composed in the style of a media or literature excerpt (see supplementary materials for paragraphs). Each paragraph contained at least one of the 60 ambiguous words, disambiguated towards the subordinate meaning3 . For the three repetition condition, the ambiguous word was used in the paragraph three times and was therefore massed in presentation (i.e., the three repetitions appeared in quick succession, within the same paragraph). The first presentation of the word always occurred in the first sentence, with the second and third repetitions distributed throughout the remainder of the paragraph, e.g.,‘The cabinet concluded that a referendum would be unnecessary, since the time it would use might only worsen the financial situation. The cabinet had been in talks for several weeks about a plethora of problems, but had only discussed the idea of a referendum over the last few days. Their decision was not a popular one, since previous cabinets held many referenda, which had proven popular with the public.’
For the one repetition condition, the paragraphs were identical to the three repetition condition except that the second and third repetitions were replaced with a substitute word of a similar meaning. This was done to remove the instance of the ambiguous word itself without altering the global meaning or length of the paragraph. For example, the one repetition version of the passage above was created by replacing ‘cabinet’/‘cabinets’ in the second and third sentence with ‘politicians.’ To fully control the number of repetitions, the ambiguous words did not appear anywhere in the experiment except for their respective priming paragraphs and in the test task. The paragraphs were spoken by a British English speaker (Jennifer M. Rodd) and were digitally recorded in a sound-proof booth. For each paragraph, we created a written summary sentence (mean length 8.8 words), and participants rated how well this sentence summarised the paragraph (to encourage close attention to the paragraph; see Procedure). The summary for a given item was the same for both the one and three subordinate prime conditions. All summaries were designed to be a similarly reasonable level of quality (as quality-judgment/relatedness was the task for the participants, as explained in the Procedure)","Finally, in contrast to these two views, which both assume that it is the timing of the events that drives the observed spacing effect, we must consider an alternative view that this effect is instead driven by differences in contextual variation between massed and spaced exposures. This account proposes that spacing benefits can be explained by an encoding variability mechanism (Maddox, 2016). According to Mensink and Raaijmakers (1989) and Raaijmakers (2003), the general context surrounding a stimulus naturally fluctuates over time and this context is encoded with each presentation of a stimulus. As the temporal spacing of repetitions gets longer, the natural context is more likely to vary and that variation between stimulus encodings increases the likelihood/ magnitude of learning from that stimulus. Hence, this account would suggest that the spacing benefit arises due to the increase in different encoded contexts for the spaced word-meaning exposures, which would subsequently make the meaning more available. This model is akin to the concept of contextual diversity (Adelman, Brown, & Quesada, 2006; van Heuven, Mandera, Keuleers, & Brysbaert, 2014), which has been shown to affect word processing (lexical decision performance is better explained by contextual diversity across word occurrences than by just the frequency of occurrence). Similarly, the “One Sense per Discourse” principle (e.g., Gale et al., 1992) is based on the finding that an ambiguous word encountered multiple times within a discourse is highly likely to be used in the same meaning across those encounters, and suggests that an interlocutor would treat one subordinate repetition and three subordinate repetitions within the same discourse/paragraph as equivalents because they both provide one overall piece of evidence about one meaning (as opposed to multiple separate/spaced pieces of evidence of that one meaning).
However, we believe that this encoding variability/contextual diversity/“One Sense per Discourse” type of account is less likely to provide an explanation for the current data. Although this account can explain the observed boost for spaced presentations compared to massed presentations, it cannot explain why three massed repetitions did not boost priming compared to one repetition, given that in Experiments 2 and 3 its two additional repetitions were presented in three separate sentences that did not link together into a coherent discourse. Even in the massed condition, these three sentences proRETUNING OF LEXICAL-SEMANTIC REPRESENTATIONS 17 vided different contextual information and were distinctly presented in separate pieces of discourse (each sentence was followed by the judgment of relatedness of a probe word, and the sentences were unrelated) so this should provide enough contextual variation to see an increase in priming (compared with one repetition) even for the massed condition and even though the overall situational context did not vary a great deal. Yet, the massed condition provided no additional priming compared to one repetition, despite its two additional and distinct sentences/discourses of varying contextual information. While contextual variation accounts consider the general surrounding context rather than context within the sentence, it seems unlikely that additional sentential context would not boost priming if context were such an integral factor in priming. This makes the contextual variation account an unlikely explanation for the present findings. Clearly, it seems that there are several possible mechanisms underlying the spacing benefit but, as aforementioned, this requires further research to disentangle.
Importantly, the observed lack of benefit for multiple massed repetitions is likely to be advantageous from a communication point of view, as these instances are not always representative of the broader word usage. For instance, a conversation with a tree surgeon might involve the tree meaning of ‘bark’ multiple times in a short passage/ time-frame of perhaps minutes. If meaning preferences updated cumulatively with each of these repetitions, then this conversation alone would have a disproportionately large effect on meaning preferences for ‘bark’ compared with hearing the same number of ‘tree bark’ repetitions over a longer time-frame of perhaps days or weeks. In this case, the overly sensitive change in meaning preferences would be inefficient. In contrast, if additional word-meaning repetitions only alter representations when sufficiently spaced, lexical-semantic representations might still be somewhat sensitive to the listener’s immediate environment but would primarily reflect the listener’s long-term, temporally distributed (spaced) experience with word usage, which are more likely to accurately predict how these words are used in the future. Under this account, exposure to multiple instances of a word used with its low-frequency meaning would produce a smaller biasing effect on its lexical-semantic representation, and therefore this representation would more likely generalise to future encounters.
Adults’ lexical-semantic representations are updated dynamically in response to ongoing experience to reflect the most likely meaning of words. The present studies investigated the changes that occur as a consequence of exposure to the meanings of an ambiguous word. The results replicate the word-meaning priming effect and go further in showing that multiple subordinate repetitions provided an additional boost to priming compared with one repetition when these encounters were spaced, although this boost was eliminated when multiple repetitions were massed, at least in a word association test. Moreover, one repetition of the dominant meaning reduced, but did not eliminate, the effect of prior subordinate meaning priming. These results indicate that the experience-based changes to lexical-semantic representations are not solely based on the most recent encounter with a word meaning, nor does the effect occur with the same magnitude across repeated encounters. Rather, word-meaning interpretation appears to reflect the accumulation of recent experiences with wordmeanings, where the temporal spacing of multiple encounters is key to producing additional learning effects. This seems to provide a balance among the influences of word usage patterns across a range of timescales, such that listeners can dynamically retune and update their lexical-semantic representations in response to recent experience while maintaining their longer-term knowledge of word-meaning dominance."
