,title,methods,discussion
11,Predicting complex syntactic structure in real time  Processing of negative sentences in Russian,"Twenty-eight Russian-speaking volunteers (age 18–35 years) gave informed consent to participate in the study. All participants were students who were at or had graduated from a university, had normal or corrected vision, and reported no history of language disorders. They were tested on the premises of Moscow State University or St Petersburg State University.
Twenty-eight Russian-speaking volunteers (age 18–35 years) gave informed consent to participate in the study. All participants were students who were at or had graduated from a university, had normal or corrected vision, and reported no history of language disorders. They were tested on the premises of Moscow State University or St Petersburg State University. Material B) that followed the same sentence structure as that shown in (3). For the completion task the sentences such as (3) were truncated after the second or the third NP, yielding two accusative and two genitive conditions listed in Table 1. Across all sets, the critical second NP was an inanimate plural noun in order to avoid ambiguity between genitive and accusative forms found in other Russian nouns (see Footnote 2).4 Participants had to provide a natural completion for each sentence fragment (they were instructed to skip any fragments that they considered ungrammatical). If Russian speakers can resort to genitive-of-negation in order to license a genitive NP, continuations containing a negated embedded verb in both genitive conditions should be expected. The rate of such completions was predicted to be lower in the Gen-only condition than in the Gen+Dat condition, as the former also allows a completion with a monotransitive quirky verb that takes the genitive NP as a direct object. The two accusative conditions were used for estimating a “baseline” rate of negative completions in a case where either an affirmative or a negative continuation is available
Each participant filled out a paper questionnaire with 20 sentences to complete—that is, eight experimental sentences (two items for each of four conditions in Table 1) interspersed with 12 filler sentences.","A final point before discussing the implications of the findings for parsing theories is that whereas the results demonstrate that the parser anticipates negation as a licensor for the genitive NP, they are not conclusive as to whether alternative licensors are considered in parallel. Recall that in the offline sentence fragment completion task (Experiment 1) alternative licensors for the genitive NP (in particular, adverbs) were offered, albeit infrequently. This, together with an active prediction of a negated verb in the online task, indicates that in the current stimulus set the combination of grammatical, word-order, and frequency considerations disfavours most alternative licensors. Yet, I remain agnostic whether, during online processing of the experimental sentences, the few remaining possibilities (in particular, numerals or adverbs) are fully disregarded or whether they are considered in parallel with the genitive-of-negation structure.
As mentioned earlier, the results from Experiments 2 and 3 are notable as they point to anticipatory projection of multiple heads—that is, the verb and negation. Thus they argue against strongly bottom-up approaches to structure building such as headdriven parsing models (Abney, 1989; Mulders, 2003; Pritchett, 1992) by demonstrating that the verb and negation heads are projected ahead of bottom-up input on the basis of preverbal arguments. Most previous research demonstrated prediction of a verbal head in head-final languages in which such prediction could potentially be viewed as a last resort response to a ubiquitous necessity to deal with preverbal arguments, as unattached NPs would regularly result in a significant working memory load. The current demonstration that verb heads can be predicted in Russian, a non-head-final language, is notable and suggests a wider role for predictive structure-building algorithms (see also Pablos, 2006, for Spanish, Omaki et al., 2015, for English wh-dependencies). In particular, the standard left-corner parsing algorithm (Abney & Johnson, 1991; Stabler, 1994, among others) in combination with lexicalized grammar can be used to explain the results. The left-corner strategy has a top-down predictive component that operates as follows: Once the first constituent of a phrase is recognized in the bottom-up input, the prediction of a subsequent constituent can be triggered on the basis of a syntactic rule. For example, once a NP is formed bottom-up (e.g., The boy . . . ), the rule S → NP + VP is invoked, of which the NP is the left-hand-side constituent (i.e., “left corner”), which in turn triggers projection of a VP ahead of bottom-up input. In the accusative condition, upon encountering the accusative and dative NPs in the bottom-up input, the parser predicts a ditransitive verb using VP → V + NPACC + NPDAT rule (recall that in Russian word order is flexible, and hence NPACC + NPDAT can appear before the verb and serve as a left corner) and incorporates the preverbal NPs into a connected structure. Negation is not actively predicted in the accusative condition on the basis of this rule and must be added into the parsing tree on the basis of bottomup input. In the genitive condition, when NPGEN is encountered it can trigger prediction of a quirky verb (on the basis of VP → V + NPGEN rule), another nominal (NP → N + NPGEN), adverb (AdvP → Adv + NPGEN), or negative phrase with a transitive or intransitive verb NegP → Neg + V + NPGEN or NegP → Neg + V + NPGEN + NPDAT using a left-corner strategy (NPGEN is a valid left corner in all these cases as the nominal arguments can precede the head). The appearance of the NPDAT in the bottom-up input invalidates all alternatives except for the latter. Note that in the case above, postulating a lexicalized genitive-ofnegation rule NegP → Neg + V + NPGEN (+ NPDAT) is critical for rendering NPGEN into a left corner that can trigger projection of negation and verb.
As an alternative to the account above that assumed a lexicalized rule NegP → Neg + V + NPGEN (+ NPDAT), the genitive-of-negation may be encoded as a combination of structural rules in a grammarbased parser. In this case there is a rule NegP → Neg + VP and a rule whereby the structural accusative case on the verb’s direct object changes to genitive. In addition, the parser should be aware of the split licensing pattern whereby case and thematic role (on NPGEN) are not assigned by the same head. These considerations on what a parser should be able to achieve will hopefully trigger further research from grammar-based parsing theorists.
In conclusion, the findings demonstrate that in Russian, a free-word-order language, morphological case information is used by the parser for predictive structure building when it is available in the input ahead of information about the heads. Such an anticipatory mechanism allows projection of multiple lexical heads when a single head is insufficient for incremental incorporation of the bottom-up material into the parsing tree."
12,An exploration of trainee practitioners’ experiences when using observation,"Interpretative phenomenological analysis (IPA; Smith, 1996) is rooted within, and combines both phenomenology (descriptive element) and hermeneutics (interpretive element; Pringle, Drummond, McLafferty, & Hendry, 2011). IPA reflects the authors’ views of constructivism in which the individual and the world are viewed as coconstructing rather than two separate bodies, wherein the researcher plays an interpretive part (Davidsen, 2013; Palmer, Larkin, De Visser, & Fadden, 2010). IPA was chosen as the qualitative approach for this study owing to the central position placed on an individual’s lived experience and their resultant sense-making of these experiences (Smith & Eatough, 2012). Alternative means of data collection have begun to adopt methods of IPA, namely focus groups (Palmer et al., 2010; Tomkins & Eatough, 2010). Using an approach through which multiple perspectives of a given phenomenon can be shared is considered to uncover both implicit thoughts and subconscious opinion (Tomkins & Eatough, 2010). As a result, focus groups can build a deeper experiential understanding of a given phenomenon due to the dynamic interplay between participants (Liamputtong, 2011).
Supervisors associated with either the BPS or BASES, were identified via their accrediting body’s website, and emailed to request permission to contact their supervisees. Primary contact with supervisors was intended for recruitment of individuals from the same supervisory group. It was considered that participants sharing the same supervisor were likely to have had previous group reflections and would not therefore be averse to sharing knowledge and experiences in a discursive environment. In some instances supervisors did not run group supervision; however this method of contact enabled greater ease when organizing focus groups due to participants residing in relative proximity to each other.
In total 16 supervisors across England and Wales were initially contacted. Due to nonresponse, or difficulties organizing a suitable date and time for all individuals, the final participant sample represented eight supervisory groups. All participants were enrolled on a training program toward either chartered psychologist (BPS) or an accredited sport and exercise scientist (BASES). The final sample of participants represented a homogenous group to align with IPA guidelines (Smith & Eatough, 2012). Across the sample were minor discrepancies between participants, including group and individual supervision, as well as variation in the stage of training, i.e., at the start, middle, and end of this process. Following institutional ethical approval and informed consent, the sample included seven males (age: M = 31.71 years, SD = 9.32 years), and 12 females (age: M = 25.33 years, SD = 1.37 years), creating five focus groups, comprising between three to five participants. Liamputtong (2011) and Litosseliti (2003) advise that smaller participant numbers in focus groups elicit greater contribution from each member, allowing for better articulation of opinion.
A natural human behavior is to discuss perceptions and opinions of specific topics in a group setting; consequently focus groups appeal to the ordinary conversation and social interaction of everyday life (Colucci, 2007; Litosseliti, 2003). Heightened interaction and sense making between participants therefore create opportunity to uncover implicit perceptions regarding observation experiences (Liamputtong, 2011; Tomkins & Eatough, 2010). To align with the principles of IPA, the researcher adopted the role of a moderator and ensured that focus groups were participant-led (Smith & Eatough, 2012). Through assuming a position as moderator, the researcher can actively engage participants and encourage discussion between group members, rather than between moderator and participant (Liamputtong, 2011).","Considering observation is a skilled practice it is alarming to find trainees have received minimal to no formal training in it. Evidence from trainees suggests they are implementing observation; however there is resounding indication this is founded on instinct and trial and error learning, rather than evidence-based practice as is endorsed by governing accreditation bodies (i.e., BPS and BASES). It is fair to assume that at this stage of a trainees’ career, observation skill is relatively low, therefore training in this much valued assessment should be essential. Proposed formal observation training was met with unanimous consensus across all trainee participants, explicitly showcasing the merit in providing such a platform of education. Most salient was the suggestion from trainees to focus on the how of observation as opposed to what and why. This conviction is supported through Brown et al. (2005) claiming current applied sport psychology training as being proficient in the development of individual techniques (i.e., what and why), but which is not adept at educating practitioners in navigating the complexities of an ever-changing sporting context (i.e., how). It is anticipated the sharing of experiences and knowledge from a varied range of practitioners, will enable reflective discussion and take home messages regarding associated challenges such as, coping with the demand of multiple variables (i.e., teams), distraction, documentation, and perception. Attention should also be given to developing an understanding of contextual intelligence and its propensity to open doors to generate greater effectiveness in applied delivery.
Practical recommendations for enhancing observation practice have been interspersed throughout this discussion. We feel it is critical that our clients are educated on the purpose and intention of observation in an attempt to dispel any negative association or discomfort linked to being observed. By selling its positive implications, it is anticipated that applied practitioners will be less inclined to conceal observation, and instead confidently observe and integrate themselves into the sporting environment. Resultant immersion into the client’s environment is recommended to help build a contextually intelligent practitioner. An increased presence, via informal observation, facilitates a deeper understanding of the complexities of a specific sporting culture, allowing practitioners to more effectively design and implement intervention. Furthermore, it is recommended to be seen in the sporting environment outside of ‘normal’ working hours in an outward display of enthusiasm and interest. Both the client and key stakeholders within the sporting organization are likely to be recognizant of this which is suggested to increase acceptance and strengthen relationships.
It is important to reflect on possible limitations of the study. Consideration is given to the combined participant sample of individuals supervised from two different accreditation systems with differing outcomes and training structures (i.e., BPS and BASES), and the potential impact this may have had on individual experiences. Reflecting on each focus group and their responses to questions regarding previous observation training, it was considered that all participants, regardless of background or training pathway produced similar answers. Thus authors felt that all participants had similar foundations in observation knowledge irrespective of which accreditation system they were affiliated with, and therefore the differences in supervision across both training pathways would be minimal. Secondly, it is recognized that a wider group of trainees from a bigger sample of supervisors across the United Kingdom may provide a better representation than drawing from a small cluster of supervisors. Lastly, it is important to consider the impact of researcher bias on the interpretation of data. Due to the relatively small community of trainee practitioners’ within the United Kingdom, the lead researcher had professional connections with some of the participants used in focus groups. However, to minimize the effects of potential researcher bias, a reflexive journal was kept in which the lead researcher acknowledged any bias and unintentional influence upon data collection and interpretation.
The most influential message to have emerged from this study is that observation is perceived to add substantial value to service delivery, which is currently vastly under acknowledged. Positive properties already associated with observation, such as triangulation and confirmatory evidence (Watson II & Shannon, 2010) has been largely reinforced, however findings have uncovered other significantly valued traits of observation. A running undercurrent throughout this discussion has been the role of contextual intelligence as an avenue worthy of much greater exploration due its potential for unlocking many of the perceived challenges already attached to observation. Exposure and raised awareness of these associated challenges (i.e., trainee preconceptions and perceptions of others) is imperative for the advancement of our profession. Future research should be directed toward the development of observation training if the profession of applied sport psychology is to aspire and develop toward an ever effective and successful discipline."
13,Need to screen for clinical levels of ocd? Four questions are the key,"Participants were recruited in three ways: (1) online (n = 298), from three OCD-related websites (International ObsessiveCompulsive Disorder Foundation, the Houston OCD Program, and the Peace of Mind Foundation); (2) a residential treatment facility (n = 127), the Houston OCD Program; and (3) in person at consumer conferences of the International OCD Foundation (n = 100). All participants completed a battery of measures, including demographic information and assessments for OCD severity. The residential treatment center used in the current study utilizes a structured diagnostic interview at the onset of treatment, the Mini-International Neuropsychiatric Interview (MINI; Sheehan et al., 1998), as well as expert clinical assessments conducted by licensed clinicians specializing in the treatment of OCD. The results of the online and consumer conferences were aggregated across two separate studies. Not all participants completed all of the measures of OCD severity because of responses being collected from separate studies requiring completion of differing measures from their participants (see Table 1). Participants in the online and residential treatment groups were asked to complete the Y-BOCS-SR, the OCIR, and the DOCS, while the conference group was given only the Y-BOCS-SR and the DOCS. Of the original 575 participants recruited, 525 met criteria for study inclusion. Participants were excluded if they were under that age of 18 or did not complete both the WHOS and at least one OCD severity measure. Demographic information is displayed in Tables 2 and 3. Participants were primarily female (60.1%), with a mean age of 34.0 (SD = 12.7; range 18–80). Participant race/ethnicity was 82.7% White, 4.4% Hispanic American, 3.6% Asian/Pacific Islander, 1.9% African American, and 7.5% Other or Withheld.
Yale-Brown Obsessive Compulsive Scale–Self-Report (YBOCS-SR). The Y-BOCS-SR (Steketee, Frost, & Bogart, 1996) is a 10-item self-report scale measuring OCD severity. Items are rated on a 5-point scale from 0 to 4, assessing for time burden, interference, distress, resistance, and control over both obsessions and compulsions. Total scores range from 0 to 40, with scores at or above 16 commonly used as the clinical cutoff for OCD. The Y-BOCS-SR displays good psychometric properties (Steketee et al., 1996).
Obsessive-Compulsive Inventory-Revised (OCI-R). The OCI-R (Foa et al., 2002) is a shortened, 18-item version of the original OCI (OCI; Foa, Kozak, Salkovskis, Coles, & Amir, 1998), measuring OCD severity. Items are rated on a 5-point Likert scale (0 = Not at all to 4 = Extremely). Total scores range from 0 to 72, with scores at or above 21 considered indicative of the likely presence of OCD. The OCI-R displays good psychometric properties.
Dimensional Obsessive-Compulsive Scale (DOCS). The DOCS (Abramowitz et al., 2010) is a 20-item self-report scale that assesses OCD severity dimensionally, including contamination, responsibility for harm and mistakes, symmetry/ordering, and unacceptable thoughts. Each subscale consists of 5 items rated 0 to 4 that assess time burden, avoidance, distress, life interference, and difficulty in disregarding or refraining from obsessions and/or compulsions. Total score ranges from 0 to 80, with scores at or above 18 considered indicative of the likely presence of OCD. The DOCS displays good psychometric properties.","The current study’s sample size was far greater than previous screener studies (Farvolden et al., 2003; Gega, Kenwright, Mataix-Cols, Cameron, & Marks, 2005; Storch et al., 2007). Unlike other studies that solely used undergraduate participants (Coles et al., 2007), the current study carefully selected established OCD websites and consumer conferences for individuals with OCD. Given that consumer conferences require time and payment by attendees, it is unlikely that individuals who attended and participated in the study were malingering. Where as other screening tools have been lengthy or difficult to read (Donker et al., 2009), the WHOS is brief, lowering participant burden. This brief screening tool may help screening for clinical purposes or research study completion and not “rule out” those without clinical levels of OCD, saving the screeners time and effort. The ease of administration, scoring, and interpretation, gives the WHOS an advantage over other screening tools that require arduous scoring and professional interpretation (Farvolden et al., 2003). In addition, the WHOS is free and readily accessible to clinicians and researchers, whereas many other screening tools are only available by purchase.
The WHOS is a useful measure when a clinician needs a brief screening or a researcher wants to reduce participant burden and in-person clinical diagnoses are not available. Given that the Internet has become a widespread venue for conducting research, it is imperative that a valid screener is used to determine OCD study inclusion and exclusion. We believe the WHOS has the potential to facilitate future research on OCD and improve the validity of online research, especially if future studies can validate how it compares with structured clinical interviews.
Despite the diversity in recruitment strategy and large sample size, there were limitations with the current study. The study lacked participant diversity in race/ethnicity, and evidence for differences in OCD severity across these groups is growing (Williams, Elstein, Buckner, Abelson, & Himle, 2012). The study would also benefit from conducting the screening with participants who are less familiar with OCD, such as university students or a clinic that treats an array of disorders. In doing so, the ability of the screener to detect OCD in a general population is likely to be strengthened.
Test–retest reliability and correlation to diagnoses established by structured clinical interviews were also absent from the present study. To improve validity, future research should include a greater number of measures taken across all groups. The screening should also be conducted in more diverse venues of treatment-seeking populations (e.g., standard outpatient settings, non-OCD-specific clinics) as well as with participants from the general population and in comparison with a healthy control group. Although the WHOS has promise, we hope this initial investigation will spark more research to establish its validity and utility."
