,title,methods,discussion
19,"Adherence to hydroxyurea, health-related quality of life domains, and patients’ perceptions of sickle cell disease and hydroxyurea  a cross-sectional study in adolescents and young adults","We conducted a cross-sectional study using nonprobability convenience sampling methodology. We approached AYA who were 12–22 years old, had SCD patients (all genotypes), were English-speaking and on a steady state dose of hydroxyurea, defined as a stable dose for 2 months or more prior to enrollment in the study. Between January 2015 and December 2015, patients were enrolled before or after their scheduled outpatient comprehensive sickle cell clinic or hydroxyurea clinic appointments. Exclusion criteria included patients with SCD on chronic transfusion support, with any haemoglobin disorder other than SCD, or with any cognitive or physical disability.
We evaluated patients’ perceptions using the brief illness perception questionnaire (B-IPQ), which was adapted to reflect hydroxyurea and SCD [28]. In the adapted B-IPQ, we replaced the word “illness” by “sickle cell disease” and the word “treatment” by “Hydroxyurea”. For example, one of the questions was “How much do you think your hydroxyurea can help your sickle cell disease?” instead of “How much do you think your treatment can help your illness?” In addition, two items were deemed not applicable and/or could be confusing for patients with SCD, and therefore were deleted in the adapted B-IPQ version. The B-IPQ has been extensively utilized in earlier studies and used in patients as young as 8 years of age [27, 28]. The adapted B-IPQ consists of 7 items or dimensions including perceived consequences of SCD, personal control of SCD, control of SCD with hydroxyurea, identity (i.e. SCDrelated symptoms), concerns about SCD, understanding of SCD, and emotional response secondary to having SCD. The “Identity” domain will be referred to as “symptoms” throughout the manuscript. Each item uses a scale from 0 to 10 to assess each dimension, and each item is evaluated as a separate subscale. Higher scores indicate stronger perceptions of each dimension of the B-IPQ. In particular, higher B-IPQ scores indicate more negative perceptions of SCD-related consequences, identity (i.e. more perceived symptoms), concerns, and emotional response, but more positive perceptions of personal control, treatment control, and understanding of SCD.
Study participants were asked to complete Patient Reported Outcomes Measurement Information System – Computerized Adaptive Testing (PROMIS®-CAT) measures using an electronic tablet [29]. PROMIS-CAT is a novel application of a comprehensive, item-response theory optimized item bank, which enables precise estimation of a PRO domain while simultaneously minimizing burden to participants [30, 31]. In CAT, items administered are selected based on informant’s previous item responses, using a pre-set computerized algorithm based on individual item information functions. Therefore, the total number of items used in different PROMIS measures vary within and in-between patients. A number of PROMIS® measures have been validated in the paediatric and adult populations [32–35], and have been recently evaluated in SCD [36, 37]. Adolescents (age 12–17 years) were asked to complete paediatric PROMIS®-CAT measures of fatigue, pain interference, physical functioning mobility and upper-extremity, depression, anxiety, and peer relationships. Young adults (age 18–22 years) were asked to complete adult PROMIS®-CAT measures of fatigue, pain interference, physical functioning mobility and upper-extremity, depression, anxiety, and social isolation. PROMIS peer relationships and social isolation measures have different set of questions, however both evaluate patients’ relationships and social support. All paediatric and most adult PROMIS®- CAT measures elicited participants’ responses based on the previous 7 days using 5-point response options ranging from “with no trouble” to “not able to do” for physical functioning measures and from “never” to “almost always” in all other measures. No timeframe was assigned to adult PROMIS physical functioning measure. Higher PROMIS® domain scores indicated better physical functioning (mobility or upper-extremity), and peer relationships, but worse severity for fatigue, pain interference, depression, anxiety, and social isolation. PROMIS®-CAT paediatric and adult measures were scored on a general population based T-score metric with a mean of 50 and a standard deviation of 10 [32, 38].
Hydroxyurea adherence was evaluated using the ©Modified Morisky Adherence Scale 8-items (©MMAS-8), which was adapted to reflect hydroxyurea and SCD. In the adapted ©MMAS-8, we replaced the words “medicine”, “medication” and “pills” with “Hydroxyurea”. ©MMAS-8 includes 7 yes/no questions and 1 multiple choice question, and evaluates adherence over the past day and 2 weeks [39, 40]. Total ©MMAS-8 numerical scores were calculated per the assessment manual. Higher ©MMAS-8 scores indicated better adherence to hydroxyurea. Based on the total ©MMAS-8 score, three levels of adherence were also considered: low (0 to <6), medium (6 to <8) and high (8).","Early reports have shown a relationship between patient and parental acceptance of hydroxyurea and their perceptions of SCD severity [20, 24–26], which may indirectly influence hydroxyurea adherence. Parents who perceived their children as having a milder form of SCD were less willing to accept the risk of hydroxyurea side effects, particularly in relation to birth defects and cancer risk [20, 24–26]. In contrast, parents of patients with severe SCD sought more information about hydroxyurea and were more accepting of its use as a preventive strategy [24, 25]. Different factors have been proposed to contribute to the decision of starting hydroxyurea in patients with SCD, including patients’ and parental perceptions. In a single-institution study, the majority of parents and patients were in favor of using hydroxyurea, which was perceived as safe and effective with balanced risks and benefits, compared to chronic transfusions and stem cell transplantation [49]. In our study, greater hydroxyurea adherence by patient self-report and higher MCV and HbF levels was associated with perceptions of greater treatment benefit from hydroxyurea, although the direction of any cause and effect relationship is not clear.
We also sought to examine patients’ perceptions of SCD and hydroxyurea in relation to their domains of HRQOL. Similar to children with other chronic conditions, children with SCD have poor HRQOL domain scores [3, 34, 36, 50]. In our cohort, patients’ perceptions correlated with different HRQOL domain scores. Patients with more negative perceptions of SCD-related consequences, concerns, and emotional response, or with less perceived benefits of hydroxyurea, reported worse fatigue, pain, anxiety, and depression scores. These relationships suggest an association between worse perceptions of SCD and/or hydroxyurea, and poor HRQOL domain scores. Nevertheless, given the nature of our cross-sectional study, we cannot determine the direction of the relationship, namely whether poor HRQOL leads to worse perceptions or that worse perceptions leads to poor HRQOL domain scores. Consistent with our results, O’Donovan et al. have shown that, in a cohort of patients with congenital heart disease, illness perceptions were also predictive of different HRQOL domains and psychological outcomes, including depression and anxiety [51].
Some limitations of our study warrant discussion. First, our study was at a single institution and data were collected from a convenience sample of SCD patients, which could limit the generalizability of our results. However, our study helped to generate further hypotheses that could inform a larger prospective study. Second, the cross-sectional design of the study limited our ability to examine the changes in patients’ perceptions, hydroxyurea adherence, and different domains of HRQOL over time. Third, we limited our study population to AYA population with a relatively narrow age range (12–22 years old). However, we focused on AYA because they represent a specific age group when patients start to take responsibility of their illness and be in charge of taking their hydroxyurea on their own, which make them at higher risk for low hydroxyurea adherence. Fourth, we evaluated SCD-related events (e.g. ED visits and hospitalizations) at our institution only and it is possible that SCD-related events elsewhere could have been missed. Finally, we used B-IPQ and ©MMAS-8 to evaluate patients’ perceptions of SCD and hydroxyurea adherence, respectively, and both have not been validated for adolescents or in SCD. To address this, we conducted pre-testing to ensure participants’ comprehension of different items of the B-IPQ and ©MMAS-8. Both measures have been used in published studies that included patients with SCD and/or other chronic conditions [14, 27, 47, 52–54], and in particular, the B-IPQ has been used in studies with patients as young as 8 years of age [27]. In addition, objective laboratory data supported patients’ perceptions and adherence levels by self-report using B-IPQ and ©MMAS-8.
Perceptions of disease and treatment amongst AYA with SCD correlated with subjective and objective adherence measures, HRQOL domain scores and number of hospitalizations. Our findings enhance our understanding of patients’ perceptions of SCD and hydroxyurea and suggest that hydroxyurea adherence is a multifactorial process. Understanding patients’ perspectives could support efforts to overcome adherence and utilization barriers. [55, 56] Given the fact that hydroxyurea adherence is a dynamic and multi-factorial process, changes in patients’ perceptions of hydroxyurea and how it helps them maintain control of their illness could serve as surrogate markers for early changes in hydroxyurea adherence over time. Therefore, our results suggest that a longitudinal prospective assessment of patients’ perceptions may reveal modifiable factors associated with early changes in hydroxyurea adherence and HRQOL over time. Routine assessment of patients’ perceptions of hydroxyurea and SCD, adherence to hydroxyurea, and HRQOL in SCD outpatient settings should be considered using different platforms. Given the wide access to technology [21, 57, 58], web- or mobile-based platforms could be utilized to allow the completion of different assessments more frequently, and in-person or remotely in different settings."
20,Adjusting to the Receiving Country Outside the Sport Environment  A Composite Vignette of Canadian Immigrant Amateur Elite Athlete Acculturation,"After receiving university Institutional Research Ethics Board approval, the authors used their connections with various national sport associations and national sport centers to gain a list of potential immigrant athletes who would be suited to the study and extend an initial recruitment invitation for the athletes to participate. This recruitment process was initiated through posted invitations to participate by Skype, with follow-up e-mails sent to the coaching fraternity of nationally accredited coaches and to executive directors from national sport organizations. When a positive response was received from immigrant athletes by their coaches, the athletes’ contact information was forwarded to the first author. Either the first or second author then followed up with the athletes to provide information about the project.
Participants were 24 national- and international-level athletes who had immigrated to Canada during their teenage years and early adulthood. At the time of the interviews, the participants had been living in Canada for an average of 8.6 years. The participants relocated to Canada for nonsport reasons, though all but two were recognized athletes within their home countries before relocation. Hence, these athletes embarked on their acculturation processes during adolescence and continued onward in this process into adulthood. Eighteen of the participants were male, and six were female. At the time of the study the athletes ranged in age from 18 to 32 years (M = 23 years). Participants came from 10 sports: boxing (n = 6), swimming (n = 5), badminton (n = 2), judo (n = 2), karate (n = 2), basketball (n = 2), rugby (n = 2), soccer (n = 1), racquetball (n = 1), and bobsleigh (n = 1). They immigrated to Canada from 20 countries, divided by continents as follows: North America (n = 2), South America (n = 1), Europe (n = 10), Asia (n = 7), Australia (n = 1), and Africa (n = 3).
Given that the participants were geographically dispersed across Canada, the second author met with each individual and conducted data collection over Skype, whereby face-to-face contact was enabled remotely. This particular approach to data collection has recently been termed “computer-mediated interviewing” (see Sparkes & Smith, 2014). A synchronous approach was utilized whereby both researcher and participant used the Internet at the same time (i.e., they meet on the Internet). Sparkes and Smith proposed that Skype interviewing, one form of synchronous interviewing, has various advantages over in-person interviewing. Among these, it is proposed that when the participants and researchers are not sitting physically in the same room, participants might feel comfortable to disclose information that they would have retained had the interview been in person. As well, the use of Skype permitted the researchers to interview audio athletes from across Canada and those training abroad through a medium where physical distance could be overcome.
To begin eliciting stories the participants created drawings that reflected their experiences as immigrant athletes in Canada. The participants were given the choice to create their images in the form of a circle (known as a mandala; see Blodgett et al., 2013), as a flowing river, in the form of a tree, or as a freehand image. Arts-based methods had been used extensively in the coauthors’ earlier projects. During these projects, in keeping with Coholic and LeBreton’s (2007) resilience research, the participants found these activities both enjoyable and conducive with self-disclosure. Within the current project, all of the participants were willing to engage in this activity and chose forms that resonated with them most. Once the participants had created their drawings, the images were used to facilitate conversational interviews. Many of the participants then shared that by connecting their drawings with their stories, they learned more about their own reflections as acculturating newcomer athletes. This unstructured and open-ended type of interviewing was selected for two key reasons. First, aligning with the aim of the present study and its narrative approach, the conversational approach invited rich storytelling. Participants were asked to reflect on their experiences holistically and open-endedly and were encouraged to bring forward narratives that could reveal multiple, intersecting layers of experience. This approach helped to “capture” the multifaceted nature of participants’ lives, rather than gloss over it (McGannon & Smith, 2015; Smith & Sparkes, 2009). Second, the conversational interview facilitated a participatory process (Blodgett & Schinke, 2015; Blodgett, Schinke, McGannon, & Coholic, 2014).","Moving further into the vignette with “weighing the risks for the journey ahead,” complexity is layered into why it is that the athlete struggles playing out the role of “newcomer.” Blodgett et al. (2014) referred to this struggle as navigating the outsider–insider hyphen, wherein the athlete is never fully considered an insider or an outsider but is simply in a state of flux in between these positions. Within the previous, initial theme, the authors found the athlete referring to the earliest steps associated with acculturation—getting oneself rooted in schooling, a job, and in a physical locale, aspects commonly identified in acculturation scholarship (e.g., Schwartz et al., 2010; Steiner, 2009). With the vignette’s expansion in this theme, there is an overt focus on what is already recognized as a delicate topic—forging social relationships with peers (Berry, 1997). The athlete clearly wishes to belong among peers and yet finds that seeking this acceptance has become a series of trade-offs (Schinke et al., 2013). These tradeoffs include the beginnings of being ridiculed, first for not understanding what is being said and then later for the accent the athlete brings to social exchanges, when able to make oneself understood. These punishing formative experiences appear to deepen Ryba et al.’s (2012) findings in sport contexts where there is a lack of interest in relatedness or understanding on the part of those from the receiving country. There appears to be a taken-for-granted assumption that the dominant group need not engage in any form of acculturation and that when they do, these are unusual experiences. Cultural learning seems to be imposed on the newcomer in a manner that deepens feelings of loneliness and isolation (see Blodgett & Schinke, 2015; Schinke et al., 2013). We find in this theme that for the athlete to be accepted, there must first be tolerance that one is going to be laughed at and stung. Furthermore, there will be no acknowledgment by the receiving culture of the emotional and psychological repercussions for these athletes, deepening the divide and distrust between receivers and the newcomer and sustaining the tenuous moves form positive to negative (see Blodgett & Schinke, 2015). Should the athlete accept and open oneself to these assaults, new friendships can be forged at the expense of tolerating ridicule and being systematically emotionally injured (Ryba et al., 2012). The hope is to become closer with peers, but what sits in the balance is the athlete’s feelings of humiliation or anger of becoming the brunt of a standing joke, with open emotional sores (Schinke et al., 2006). The question then lingers: Will attempting to learn the language be a step toward forging friendships, or might it materialize into having the newcomer constantly navigating the borderland between outside and insider, contributing to emotional exhaustion?
The sport psychology consultant has an important role to play in supporting the newcomer in this frustrating process, ideally in strategies that foster engagement instead of avoidance. The consultant is clearly not able to help craft a welcoming environment throughout the day, because the environment under discussion is away from sport. However, the consultant can follow up with the newcomer and seek to understand what sorts of social connections are being forged and whether the athlete is being ridiculed. The consultant might also help structure a functional network for the athlete among peer athletes to ensure that acceptance, at least within the sport environment, is adaptive and sensitized to the challenges posed by being a newcomer when away from sport. The aforementioned aspects place the onus of acculturating on the newcomer, and it should be recognized that acculturation is a highly interactive/social process. In addition to the direct work undertaken with the athlete, the practitioner might also reflexively examine where she or he might be contributing to feelings of alienation on the part of the athlete (McGannon & Johnson, 2009; Schinke et al., 2012). Some critical reflections should also be undertaken by consultants, by placing themselves in the shoes of newcomers with whom they work with and asking, “How would I feel if I were in a similar new situation, where layers of unfamiliarity are being encountered all at once?” The consultant might also consider, “How would I want to be approached and supported if I were the newcomer?” This shifting spotlight onto the sport psychologist would permit critical introspection, leading to sensitized understandings of what the newcomer might be undergoing away from sport.
The story then continues in the final theme, “Public Stonings,” with the athlete opening up a much deeper analysis of the pain associated with what it is like to acculturate. The athlete describes the initial shock of having to come up to speed with unfamiliar cultural practices and ways of doing things quickly upon landing in the receiving country, akin to what has been referred to as culture shock (Blodgett et al., 2014). In relation to experiencing culture shock, the vignette now exemplifies facets that the athlete associates with being overloaded with new information and practices to make sense of as part of second culture learning (see Rudmin, 2009) and why overloading happens, leading to the metaphor of being pelted by rocks, and all that it is associated with (e.g., ridicule, emotional pain). There are many commonly found aspects that need attending to, each its own rock, such as managing educational needs, struggling through new tastes and unfamiliar food, and living in a new location (see also Bowskill et al., 2007). While the athlete is experiencing these unfamiliar aspects of the receiving country and locale (see also Schinke et al., 2007), there are no supportive social connections to draw upon as guides, or as refuge, to help smooth the transition. These uncharted experiences are akin to what Schinke et al. (2013) referred to as shouldered acculturation (see also Bowskill et al., 2007). When there are no guides to link up with to help mentor the newcomer, much of the learning is gained firsthand. These attempts seem nerve-racking with many painful missteps, the first ones albeit tentative, that leave the athlete exposed and humiliated, similar to Tanaka’s (2014) professional rugby players, Meisterjahn and Wrisberg’s (2013) professional basketball players, or Schinke et al.’s (2011) boxers. In relation to these early catalysts, the sport psychology consultant can serve as someone who listens and seeks to understand how it is that the newcomer athlete feels overwhelmed when away from the training environment. The consultant can also serve as an initial contact person and social connector for the newcomer, linking the athlete to pertinent resources and community groups. This offering might continue, with the support of the coaching staff, until the athlete develops a social network of peers. Once peer relationships are formed, these people might begin to help mentor and support athletes toward settlement. Undertaking this broader support might avert athletes, such as the minor league baseball players Kontos (2009) identified, withdrawing from the receiving culture, underachieving in sport, and becoming underutilized and eventually deselected.
Within this project, a focus was placed on life outside of sport for national and international amateur athletes who became citizens in an unfamiliar receiving country. The vignette, comprising three themes, reveals layers of uncertainty that seem to serve as barriers to healthy social relationships outside of the sport environment. These uncertainties include, on one hand, recognition of the possibilities the unfamiliar country might offer and, in the balance, tenuous challenges that might impede the acculturation process. Although no clear solutions can be brought forth from a single project in relation to how any newcomer might navigate acculturation challenges outside of the sport environment, there is evidence that this part of the acculturation process (i.e., the nonsport experiences) is extremely delicate, highly social, and possibly damaging to the newcomer. Although solutions regarding how to effectively acculturate are not easily determined, it does become clearer that the role of the sport psychology consultant in relation to this process necessitates a holistic approach to practice, working with the whole person, in relation to nonsport life. Conversely, focusing exclusively on the sport context would be to ignore a sizeable part of the newcomer’s life during these moments of vulnerability."
